{
  "schema_version": "1.0",
  "stage": "dynamic",
  "sample": {
    "original_sha256": "0000000000000000000000000000000000000000000000000000000000000000",
    "target_path": "C:/guest/sample.exe",
    "target_sha256": "0000000000000000000000000000000000000000000000000000000000000000"
  },
  "status": "completed",
  "summary": "Runtime observation completed.",
  "findings": [],
  "artifacts": [],
  "investigation_targets": [],
  "limitations": [],
  "upstream_inputs": [
    "02-static-pass1.json"
  ],
  "runtime": {
    "executed": true,
    "guest_only": true,
    "aslr_base": "0x400000",
    "stop_reason": "analysis_complete",
    "observation_window": "120 seconds"
  },
  "behaviors": [],
  "iocs": {
    "network": [],
    "host": [],
    "persistence": []
  }
}